{
  "schemaVersion": 1,
  "repository": { "provider": "github", "owner": "JamieGeddes", "name": "factorial" },
  "number": 220,
  "url": "https://github.com/JamieGeddes/factorial/pull/220",
  "headBranch": "factorial/c8db78d0-d4bd-11f1-8764-65fa7aa28432",
  "merged": true,
  "closedAt": "2026-10-31T09:12:40Z",
  "mergedAt": "2026-10-31T09:12:40Z",
  "mergeCommit": "407914d6c2a1b0f3e8d95a7c4b1e2f3a4d5c6b7a",
  "by": "JamieGeddes"
}
